{
  "schema_version": "medioevo.renderer_capability_profile.v0.1",
  "profile_id": "renderer-canvas-low",
  "backend": "canvas_low",
  "max_active_lights": 3,
  "supports_normal_maps": false,
  "supports_workers": true,
  "supports_webgl": false,
  "memory_tier": "low",
  "boundary": { "publication_gate": "BLOCK", "contains_private_data": false, "public_safe": true }
}

